{"componentChunkName":"component---src-templates-note-jsx","path":"/apos-alteraco-de-nome-e-sexo","result":{"data":{"mdx":{"body":"var _excluded = [\"components\"];\nfunction _extends() { _extends = Object.assign ? Object.assign.bind() : function (target) { for (var i = 1; i < arguments.length; i++) { var source = arguments[i]; for (var key in source) { if (Object.prototype.hasOwnProperty.call(source, key)) { target[key] = source[key]; } } } return target; }; return _extends.apply(this, arguments); }\nfunction _objectWithoutProperties(source, excluded) { if (source == null) return {}; var target = _objectWithoutPropertiesLoose(source, excluded); var key, i; if (Object.getOwnPropertySymbols) { var sourceSymbolKeys = Object.getOwnPropertySymbols(source); for (i = 0; i < sourceSymbolKeys.length; i++) { key = sourceSymbolKeys[i]; if (excluded.indexOf(key) >= 0) continue; if (!Object.prototype.propertyIsEnumerable.call(source, key)) continue; target[key] = source[key]; } } return target; }\nfunction _objectWithoutPropertiesLoose(source, excluded) { if (source == null) return {}; var target = {}; var sourceKeys = Object.keys(source); var key, i; for (i = 0; i < sourceKeys.length; i++) { key = sourceKeys[i]; if (excluded.indexOf(key) >= 0) continue; target[key] = source[key]; } return target; }\n/* @jsxRuntime classic */\n/* @jsx mdx */\n\nvar _frontmatter = {\n  \"title\": \"O que fazer após alteração de nome e sexo na certidão?\",\n  \"description\": \"um guiazinho pra entender o que fazer depois de conseguir sua certidão com seu nome novo s2 s2\",\n  \"tags\": [\"transicao-de-genero\", \"transgeneridade\", \"genero\"],\n  \"date\": \"2022-08-09T01:00:00.000Z\",\n  \"source\": \"[[Retificação]]\"\n};\nvar layoutProps = {\n  _frontmatter: _frontmatter\n};\nvar MDXLayout = \"wrapper\";\nreturn function MDXContent(_ref) {\n  var components = _ref.components,\n    props = _objectWithoutProperties(_ref, _excluded);\n  return mdx(MDXLayout, _extends({}, layoutProps, props, {\n    components: components,\n    mdxType: \"MDXLayout\"\n  }), mdx(\"p\", null, \"Esse texto \\xE9 baseado no \", mdx(\"a\", {\n    parentName: \"p\",\n    \"href\": \"https://github.com/darakeon/lcsd\"\n  }, \"reposit\\xF3rio de Darakeon no Github\"), \" numa vers\\xE3o atualizada e no documento da Casa 1:\"), mdx(\"p\", null, mdx(\"a\", {\n    parentName: \"p\",\n    \"href\": \"https://www.casaum.org/wp-content/uploads/2022/07/RETIFIQUEI_E_AGORA__COM_FICHA_V2.pdf\"\n  })), mdx(\"p\", null, \"OBS: Lembrando que essa lista \\xE9 v\\xE1lida para pessoas que est\\xE3o em SP, mas pode ser que seja aplic\\xE1vel \\xE0 outras cidades.\"), mdx(\"hr\", null), mdx(\"h3\", null, \"Emitir um novo RG\"), mdx(\"p\", null, \"Agende um hor\\xE1rio como Segunda Via do RG no Poupatempo e, no dia marcado, v\\xE1 com 2 c\\xF3pias da nova certid\\xE3o de nascimento e do antigo RG. Voc\\xEA tamb\\xE9m vai precisar mostrar documentos como carteira de trabalho, titulo de eleitor e CHN. O Poupatempo \\xE9 obrigado a reter seu antigo RG, por isso \\xE9 bom voc\\xEA pegar uma c\\xF3pia do antigo RG pra si.\"), mdx(\"p\", null, \"Voc\\xEA ter\\xE1 que pagar R$45,90 reais para emiss\\xE3o do RG e o a entrega \\xE9 realizada em 15 dias ou no pr\\xF3prio Poupatempo ou na sua casa - se voc\\xEA escolheu a entrega a domicilio, \\xE9 claro.\"), mdx(\"h3\", null, \"Alterar dados do CPF na Receita Federal\"), mdx(\"p\", null, \"A altera\\xE7\\xE3o de dados no CPF pode ser solicitada em:\"), mdx(\"p\", null, mdx(\"a\", {\n    parentName: \"p\",\n    \"href\": \"https://servicos.receita.fazenda.gov.br/Servicos/CPF/alterar/default.asp\"\n  }, \"https://servicos.receita.fazenda.gov.br/Servicos/CPF/alterar/default.asp\")), mdx(\"p\", null, \"A p\\xE1gina inicial do site j\\xE1 mostra o formul\\xE1rio onde voc\\xEA vai colocar seu novo nome e sexo. \"), mdx(\"p\", null, \"Ap\\xF3s o preenchimento, voc\\xEA deveria mandar um e-mail para a Receita Federal do Brasil na regi\\xE3o especificada na lista de e-mails que aparecer\\xE1 ap\\xF3s a confirma\\xE7\\xE3o dos dados do formul\\xE1rio. Nesse e-mail deve conter: \"), mdx(\"blockquote\", null, mdx(\"p\", {\n    parentName: \"blockquote\"\n  }, \"\\xB7 Documento de Identifica\\xE7\\xE3o:\"), mdx(\"ol\", {\n    parentName: \"blockquote\"\n  }, mdx(\"li\", {\n    parentName: \"ol\"\n  }, \"Para maiores de 16 anos: RG atualizado. Se o RG n\\xE3o estiver atualizado, anexar tamb\\xE9m a Certid\\xE3o de Casamento ou Nascimento.\"), mdx(\"li\", {\n    parentName: \"ol\"\n  }, \"Para menores de 16 anos: RG ou Certid\\xE3o de Nascimento do menor e RG do respons\\xE1vel ( pai, m\\xE3e ou tutor ou guardi\\xE3o judicial). Na hip\\xF3tese de representa\\xE7\\xE3o por tutor ou guardi\\xE3o, anexar tamb\\xE9m o respectivo termo de tutela/guarda.\")), mdx(\"p\", {\n    parentName: \"blockquote\"\n  }, \"\\xB7 T\\xEDtulo de eleitor, se possuir;\"), mdx(\"p\", {\n    parentName: \"blockquote\"\n  }, \"\\xB7 Comprovante de endere\\xE7o;\"), mdx(\"p\", {\n    parentName: \"blockquote\"\n  }, \"\\xB7 Protocolo de atendimento fornecido pela entidade conveniada (Banco do Brasil, Correios e Caixa Econ\\xF4mica) ou Protocolo de Atendimento gerado na Internet, se possuir;\"), mdx(\"p\", {\n    parentName: \"blockquote\"\n  }, \"\\xB7 Foto (\\\"\", mdx(\"em\", {\n    parentName: \"p\"\n  }, \"selfie\"), \"\\\") do interessado ou respons\\xE1vel (\", mdx(\"strong\", {\n    parentName: \"p\"\n  }, \"se for menor que 16 anos\"), \") segurando o documento de identidade, em que apare\\xE7a a foto e o n\\xFAmero do documento.\")), mdx(\"p\", null, \"Caso voc\\xEA v\\xE1 presencial a Receita Federal, tenha em m\\xE3os a c\\xF3pia do RG anterior, a carteira de trabalho, a certid\\xE3o de nascimento antiga e a atual.\"), mdx(\"h3\", null, \"Atualiza\\xE7\\xE3o dados no INSS\"), mdx(\"p\", null, \"A atualiza\\xE7\\xE3o de dados cadastrais do INSS pode ser realizada em:\"), mdx(\"p\", null, mdx(\"a\", {\n    parentName: \"p\",\n    \"href\": \"https://www.gov.br/inss/pt-br/saiba-mais/seus-direitos-e-deveres/atualizacao-de-dados-cadastrais\"\n  }, \"https://www.gov.br/inss/pt-br/saiba-mais/seus-direitos-e-deveres/atualizacao-de-dados-cadastrais\")), mdx(\"h3\", null, \"Carteira de Trabalho\"), mdx(\"blockquote\", null, mdx(\"p\", {\n    parentName: \"blockquote\"\n  }, mdx(\"strong\", {\n    parentName: \"p\"\n  }, \"A Carteira de Trabalho \\xE9 Digital desde setembro de 2019\"), \" - \", mdx(\"a\", {\n    parentName: \"p\",\n    \"href\": \"https://www.in.gov.br/en/web/dou/-/portaria-n-1.065-de-23-de-setembro-de-2019-217773828\"\n  }, \"Portaria n\\xBA 1.065, de 23 de setembro de 2019.\"), \" Os dados pessoais na Carteira de Trabalho digital s\\xE3o os do Cadastro de Pessoa F\\xEDsica - CPF. Desta forma, qualquer tipo de altera\\xE7\\xE3o, com rela\\xE7\\xE3o ao nome, data de nascimento, sexo, nome da m\\xE3e e nacionalidade, dever\\xE1 ser feita junto \\xE0 Receita Federal.\")), mdx(\"p\", null, \"Sendo assim, a Carteira de Trabalho digital \\xE9 atualizada \\xE0 partir do momento que a atualiza\\xE7\\xE3o dos dados do CPF \\xE9 confirmada. Caso voc\\xEA precise da carteira de trabalho f\\xEDsica, o pedido \\xE9 no Fale Conosco do Poupatempo, ou seja, por e-mail. Mesmo sendo Digital e esses registros estarem online, parafrazeando Darakeon: n\\xE3o coloque fogo na Carteira de Trabalho anterior, em nenhum documento antigo na verdade. Acredite, voc\\xEA vai precisar deles num futuro pr\\xF3ximo.\"), mdx(\"h3\", null, \"Titulo de Eleitor\"), mdx(\"p\", null, \"Confira as informa\\xE7\\xF5es para fazer qualquer tipo de altera\\xE7\\xE3o do Titulo de Eleitor online pelo TItulo Net em:\"), mdx(\"p\", null, mdx(\"a\", {\n    parentName: \"p\",\n    \"href\": \"https://www.tse.jus.br/eleitor/titulo-de-eleitor/pre-atendimento-eleitoral-titulo-net/pre-atendimento-eleitoral-titulo-net/\"\n  }, \"https://www.tse.jus.br/eleitor/titulo-de-eleitor/pre-atendimento-eleitoral-titulo-net/pre-atendimento-eleitoral-titulo-net/\")), mdx(\"blockquote\", null, mdx(\"p\", {\n    parentName: \"blockquote\"\n  }, \"Voc\\xEA poder\\xE1 requerer a \", mdx(\"a\", {\n    parentName: \"p\",\n    \"href\": \"https://www.youtube.com/watch?v=W8GCjqYuMnU\"\n  }, \"primeira via do t\\xEDtulo (alistamento)\"), \", \", mdx(\"a\", {\n    parentName: \"p\",\n    \"href\": \"https://www.youtube.com/watch?v=eYC23SnuF-Y\"\n  }, \"mudan\\xE7a de munic\\xEDpio (transfer\\xEAncia)\"), \", \", mdx(\"a\", {\n    parentName: \"p\",\n    \"href\": \"https://www.youtube.com/watch?v=UW-q1bsRFWI\"\n  }, \"altera\\xE7\\xE3o de dados pessoais\"), \", altera\\xE7\\xE3o de local de vota\\xE7\\xE3o por justificada necessidade de facilita\\xE7\\xE3o de mobilidade ou revis\\xE3o para a regulariza\\xE7\\xE3o de inscri\\xE7\\xE3o cancelada.\")), mdx(\"p\", null, \"MAS se for muito perto da elei\\xE7\\xE3o, os servi\\xE7os do TSE s\\xE3o suspendidos e voc\\xEA s\\xF3 vai conseguir alterar ap\\xF3s a elei\\xE7\\xE3o. \\uD83D\\uDE44\"), mdx(\"blockquote\", null, mdx(\"p\", {\n    parentName: \"blockquote\"\n  }, \"Os documentos digitalizados (ou foto deles) para fazer as altera\\xE7\\xF5es online s\\xE3o:\"), mdx(\"ul\", {\n    parentName: \"blockquote\"\n  }, mdx(\"li\", {\n    parentName: \"ul\"\n  }, \"Documento oficial de identidade com foto (frente e verso).\"), mdx(\"li\", {\n    parentName: \"ul\"\n  }, \"Comprovante de resid\\xEAncia recente (no caso de transfer\\xEAncia, prazo m\\xEDnimo de tr\\xEAs meses de resid\\xEAncia no novo endere\\xE7o).\"), mdx(\"li\", {\n    parentName: \"ul\"\n  }, \"Comprovante de pagamento de d\\xE9bito com a Justi\\xE7a Eleitoral (quando houver d\\xE9bito).\"), mdx(\"li\", {\n    parentName: \"ul\"\n  }, \"Comprovante de quita\\xE7\\xE3o do servi\\xE7o militar, para o alistamento, sendo o requerente do sexo masculino (para homens com 19 anos que ainda n\\xE3o tenham t\\xEDtulo eleitoral).\")), mdx(\"p\", {\n    parentName: \"blockquote\"\n  }, mdx(\"strong\", {\n    parentName: \"p\"\n  }, \"Fa\\xE7a tamb\\xE9m uma selfie\"), \"\\xA0segurando, ao lado de sua face, o documento oficial de identifica\\xE7\\xE3o, com o lado que contenha a foto voltado para a c\\xE2mera.\")), mdx(\"h3\", null, \"Junta Militar (reservista)\"), mdx(\"p\", null, \"Sim, voc\\xEA vai ter que jurar a bandeira e \\xE9 um saco p\\xF3s pandemia. Pega todos os documentos alterados e os antigos e v\\xE1 a junta militar mais pr\\xF3xima da sua casa - o que n\\xE3o \\xE9 super recomendado, mas tenta perguntar pros homens cis da sua vida que n\\xE3o serviram no ex\\xE9rcito onde tem mais chance de voc\\xEA n\\xE3o ser convocado s\\xF3 de sacanagem. \"), mdx(\"p\", null, \"O reservista \\xE9 um documento mega importante na hora de contrata\\xE7\\xF5es CLT e tamb\\xE9m pra prestar concurso p\\xFAblico ou fazer inscri\\xE7\\xE3o em faculdade. Se p\\xE1 n\\xE3o te chamar\\xE3o, mas mesmo assim voc\\xEA vai ter que pagar uma tarifa por se alistar \\\"atrasado\\\".\"), mdx(\"h2\", null, \"Passaporte\"), mdx(\"p\", null, \"Preencher formul\\xE1rio \\u201CSolicitar novo passaporte - Divis\\xE3o de Passaporte - Pol\\xEDcia Federal\\u201D nesse site:\"), mdx(\"p\", null, mdx(\"a\", {\n    parentName: \"p\",\n    \"href\": \"http://dpf.gov.br/\"\n  })), mdx(\"p\", null, \"Segundo informa\\xE7\\xF5es da Casa 1:\"), mdx(\"blockquote\", null, mdx(\"p\", {\n    parentName: \"blockquote\"\n  }, \"Note que nesse formul\\xE1rio h\\xE1 dois campos importantes: \\u201Cnome anterior\\u201D e \\u201Cmotivo da mudan\\xE7a\\u201D. No campo \\u201CNome anterior\\u201D voc\\xEA dever\\xE1 preencher o nome que estava no Passaporte antigo e em \\u201CMotivo\\u201D, voc\\xEA deve escolher a op\\xE7\\xE3o \\u201CALTERA\\xC7\\xC3O POR DECIS\\xC3O JUDICIAL\\u201D, ainda que a retifica\\xE7\\xE3o tenha sido realizada em cart\\xF3rio, uma vez que n\\xE3o h\\xE1 uma op\\xE7\\xE3o pr\\xF3pria para isto.\")), mdx(\"blockquote\", null, mdx(\"p\", {\n    parentName: \"blockquote\"\n  }, \"Com o n\\xFAmero do Protocolo da Solicita\\xE7\\xE3o em m\\xE3os, voc\\xEA dever\\xE1 acessar o seguinte link do Agendamento - Divis\\xE3o de Passaporte - Pol\\xEDcia Federal (dpf.gov.br) e fazer o agendamento de um dia e hor\\xE1rio, em algum posto de atendimento da Pol\\xEDcia Federal, para finalizar a solicita\\xE7\\xE3o de seu novo passaporte.\")), mdx(\"h3\", null, \"Diploma ou Hist\\xF3rico Escolar\"), mdx(\"p\", null, \"Important\\xEDssimo pra inscri\\xE7\\xE3o em faculdades ou em cursos, voc\\xEA consegue alterar indo em cada uma das institui\\xE7\\xF5es com os documentos novos e antigos em m\\xE3os. No caso de Ensino B\\xE1sico (Fundamental e M\\xE9dio), se a escola n\\xE3o estiver mais funcionando, d\\xE1 pra pegar na Diretoria de Ensino que a escola est\\xE1 vinculada. \"), mdx(\"p\", null, \"Para institui\\xE7\\xF5es de Ensino Superior (Grad ou P\\xF3s Grad), levar os documentos novos e o diploma antigo pra solicitar a mudan\\xE7a do nome funciona sempre.\"), mdx(\"h3\", null, \"Micro Empreendedor Individual - MEI\"), mdx(\"p\", null, \"O MEI \\xE9 vinculado com o CPF, ent\\xE3o se o CPF tiver atualizado, poss\\xEDvelmente o cadastro do MEi tamb\\xE9m vai estar. Mas se n\\xE3o: se voc\\xEA for de SP, d\\xE1 pra solicitar a altera\\xE7\\xE3o cadastral na prefeitura por esse site: \"), mdx(\"p\", null, mdx(\"a\", {\n    parentName: \"p\",\n    \"href\": \"http://prefeitura.sp.gov.br/\"\n  })), mdx(\"h3\", null, \"Carteirinha SUS\"), mdx(\"p\", null, \"S\\xF3 chegar na UBS mais pr\\xF3xima e mostrar o novo RG junto com a c\\xF3pia do antigo, comprovante de residencia e seu Cart\\xE3o da Fam\\xEDlia e pedir a altera\\xE7\\xE3o. Sa\\xED na hora j\\xE1 que agora as carteirinhas do SUS s\\xE3o um mero papelzinho, risos.\"), mdx(\"h3\", null, \"Outros documentos n\\xE3o p\\xFAblicos\"), mdx(\"p\", null, \"Bom, acho que \\xE9 isso \\xE9 com cada um das empresas que voc\\xEA esteja vinculado como: conv\\xEAnio m\\xE9dico, bancos, contrato de aluguel, etc. \", mdx(\"strong\", {\n    parentName: \"p\"\n  }, \"Por isso \\xE9 importante voc\\xEA manter seus antigos documentos, sempre vai aparecer alguma coisa que voc\\xEA vai precisar alterar o nome e sexo nos momentos mais nada a ver da sua vida\"), \".\"), mdx(\"hr\", null), mdx(\"p\", null, \"Agora que expliquei tudinho, aqui vai uma listinha de tarefas para ajudar a lembrar de tudo que precisa ser alterado:\"), mdx(\"h2\", null, \"Lista de Tarefas\"), mdx(\"ul\", {\n    \"className\": \"contains-task-list\"\n  }, mdx(\"li\", {\n    parentName: \"ul\",\n    \"className\": \"task-list-item\"\n  }, mdx(\"input\", {\n    parentName: \"li\",\n    \"type\": \"checkbox\",\n    \"checked\": false,\n    \"disabled\": true\n  }), \" \", \" RG\"), mdx(\"li\", {\n    parentName: \"ul\",\n    \"className\": \"task-list-item\"\n  }, mdx(\"input\", {\n    parentName: \"li\",\n    \"type\": \"checkbox\",\n    \"checked\": false,\n    \"disabled\": true\n  }), \" \", \" CNH\"), mdx(\"li\", {\n    parentName: \"ul\",\n    \"className\": \"task-list-item\"\n  }, mdx(\"input\", {\n    parentName: \"li\",\n    \"type\": \"checkbox\",\n    \"checked\": false,\n    \"disabled\": true\n  }), \" \", \" Alterar dados CPF\"), mdx(\"li\", {\n    parentName: \"ul\",\n    \"className\": \"task-list-item\"\n  }, mdx(\"input\", {\n    parentName: \"li\",\n    \"type\": \"checkbox\",\n    \"checked\": false,\n    \"disabled\": true\n  }), \" \", \" Alterar dados INSS\"), mdx(\"li\", {\n    parentName: \"ul\",\n    \"className\": \"task-list-item\"\n  }, mdx(\"input\", {\n    parentName: \"li\",\n    \"type\": \"checkbox\",\n    \"checked\": false,\n    \"disabled\": true\n  }), \" \", \" Titulo de Eleitor\"), mdx(\"li\", {\n    parentName: \"ul\",\n    \"className\": \"task-list-item\"\n  }, mdx(\"input\", {\n    parentName: \"li\",\n    \"type\": \"checkbox\",\n    \"checked\": false,\n    \"disabled\": true\n  }), \" \", \" Pegar Reservista\"), mdx(\"li\", {\n    parentName: \"ul\",\n    \"className\": \"task-list-item\"\n  }, mdx(\"input\", {\n    parentName: \"li\",\n    \"type\": \"checkbox\",\n    \"checked\": false,\n    \"disabled\": true\n  }), \" \", \" Passaporte\"), mdx(\"li\", {\n    parentName: \"ul\",\n    \"className\": \"task-list-item\"\n  }, mdx(\"input\", {\n    parentName: \"li\",\n    \"type\": \"checkbox\",\n    \"checked\": false,\n    \"disabled\": true\n  }), \" \", \" Diplomas\"), mdx(\"li\", {\n    parentName: \"ul\",\n    \"className\": \"task-list-item\"\n  }, mdx(\"input\", {\n    parentName: \"li\",\n    \"type\": \"checkbox\",\n    \"checked\": false,\n    \"disabled\": true\n  }), \" \", \" Hist\\xF3rico Escolar\"), mdx(\"li\", {\n    parentName: \"ul\",\n    \"className\": \"task-list-item\"\n  }, mdx(\"input\", {\n    parentName: \"li\",\n    \"type\": \"checkbox\",\n    \"checked\": false,\n    \"disabled\": true\n  }), \" \", \" Alterar nome carteirinha SUS\"), mdx(\"li\", {\n    parentName: \"ul\",\n    \"className\": \"task-list-item\"\n  }, mdx(\"input\", {\n    parentName: \"li\",\n    \"type\": \"checkbox\",\n    \"checked\": false,\n    \"disabled\": true\n  }), \" \", \" Alterar nome nos bancos\"), mdx(\"li\", {\n    parentName: \"ul\",\n    \"className\": \"task-list-item\"\n  }, mdx(\"input\", {\n    parentName: \"li\",\n    \"type\": \"checkbox\",\n    \"checked\": false,\n    \"disabled\": true\n  }), \" \", \" Alterar nome no conv\\xEAnio m\\xE9dico\"), mdx(\"li\", {\n    parentName: \"ul\",\n    \"className\": \"task-list-item\"\n  }, mdx(\"input\", {\n    parentName: \"li\",\n    \"type\": \"checkbox\",\n    \"checked\": false,\n    \"disabled\": true\n  }), \" \", \" Alterar nome operadora telefonica/internet\"), mdx(\"li\", {\n    parentName: \"ul\",\n    \"className\": \"task-list-item\"\n  }, mdx(\"input\", {\n    parentName: \"li\",\n    \"type\": \"checkbox\",\n    \"checked\": false,\n    \"disabled\": true\n  }), \" \", \" Alterar nome IPTU/IPVA, etc\")));\n}\n;\nMDXContent.isMDXComponent = true;","rawBody":"---\ntitle: O que fazer após alteração de nome e sexo na certidão?\ndescription: um guiazinho pra entender o que fazer depois de conseguir sua certidão com seu nome novo s2 s2\ntags:\n  - transicao-de-genero\n  - transgeneridade\n  - genero\n\ndate: 2022-08-09 1:00:00\nsource: '[[Retificação]]'\n---\n\nEsse texto é baseado no [repositório de Darakeon no Github](https://github.com/darakeon/lcsd) numa versão atualizada e no documento da Casa 1:\n\n[](https://www.casaum.org/wp-content/uploads/2022/07/RETIFIQUEI_E_AGORA__COM_FICHA_V2.pdf)\n\nOBS: Lembrando que essa lista é válida para pessoas que estão em SP, mas pode ser que seja aplicável à outras cidades.\n\n---\n\n### Emitir um novo RG\n\nAgende um horário como Segunda Via do RG no Poupatempo e, no dia marcado, vá com 2 cópias da nova certidão de nascimento e do antigo RG. Você também vai precisar mostrar documentos como carteira de trabalho, titulo de eleitor e CHN. O Poupatempo é obrigado a reter seu antigo RG, por isso é bom você pegar uma cópia do antigo RG pra si.\n\nVocê terá que pagar R$45,90 reais para emissão do RG e o a entrega é realizada em 15 dias ou no próprio Poupatempo ou na sua casa - se você escolheu a entrega a domicilio, é claro.\n\n### Alterar dados do CPF na Receita Federal\n\nA alteração de dados no CPF pode ser solicitada em:\n\n[https://servicos.receita.fazenda.gov.br/Servicos/CPF/alterar/default.asp](https://servicos.receita.fazenda.gov.br/Servicos/CPF/alterar/default.asp)\n\nA página inicial do site já mostra o formulário onde você vai colocar seu novo nome e sexo. \n\nApós o preenchimento, você deveria mandar um e-mail para a Receita Federal do Brasil na região especificada na lista de e-mails que aparecerá após a confirmação dos dados do formulário. Nesse e-mail deve conter: \n\n> · Documento de Identificação:\n> \n> 1. Para maiores de 16 anos: RG atualizado. Se o RG não estiver atualizado, anexar também a Certidão de Casamento ou Nascimento.\n> 2. Para menores de 16 anos: RG ou Certidão de Nascimento do menor e RG do responsável ( pai, mãe ou tutor ou guardião judicial). Na hipótese de representação por tutor ou guardião, anexar também o respectivo termo de tutela/guarda.\n> \n> · Título de eleitor, se possuir;\n> \n> · Comprovante de endereço;\n> \n> · Protocolo de atendimento fornecido pela entidade conveniada (Banco do Brasil, Correios e Caixa Econômica) ou Protocolo de Atendimento gerado na Internet, se possuir;\n> \n> · Foto (\"*selfie*\") do interessado ou responsável (**se for menor que 16 anos**) segurando o documento de identidade, em que apareça a foto e o número do documento.\n> \n\nCaso você vá presencial a Receita Federal, tenha em mãos a cópia do RG anterior, a carteira de trabalho, a certidão de nascimento antiga e a atual.\n\n### Atualização dados no INSS\n\nA atualização de dados cadastrais do INSS pode ser realizada em:\n\n[https://www.gov.br/inss/pt-br/saiba-mais/seus-direitos-e-deveres/atualizacao-de-dados-cadastrais](https://www.gov.br/inss/pt-br/saiba-mais/seus-direitos-e-deveres/atualizacao-de-dados-cadastrais)\n\n### Carteira de Trabalho\n\n> **A Carteira de Trabalho é Digital desde setembro de 2019** - [Portaria nº 1.065, de 23 de setembro de 2019.](https://www.in.gov.br/en/web/dou/-/portaria-n-1.065-de-23-de-setembro-de-2019-217773828) Os dados pessoais na Carteira de Trabalho digital são os do Cadastro de Pessoa Física - CPF. Desta forma, qualquer tipo de alteração, com relação ao nome, data de nascimento, sexo, nome da mãe e nacionalidade, deverá ser feita junto à Receita Federal.\n> \n\nSendo assim, a Carteira de Trabalho digital é atualizada à partir do momento que a atualização dos dados do CPF é confirmada. Caso você precise da carteira de trabalho física, o pedido é no Fale Conosco do Poupatempo, ou seja, por e-mail. Mesmo sendo Digital e esses registros estarem online, parafrazeando Darakeon: não coloque fogo na Carteira de Trabalho anterior, em nenhum documento antigo na verdade. Acredite, você vai precisar deles num futuro próximo.\n\n \n\n### Titulo de Eleitor\n\nConfira as informações para fazer qualquer tipo de alteração do Titulo de Eleitor online pelo TItulo Net em:\n\n[https://www.tse.jus.br/eleitor/titulo-de-eleitor/pre-atendimento-eleitoral-titulo-net/pre-atendimento-eleitoral-titulo-net/](https://www.tse.jus.br/eleitor/titulo-de-eleitor/pre-atendimento-eleitoral-titulo-net/pre-atendimento-eleitoral-titulo-net/)\n\n> Você poderá requerer a [primeira via do título (alistamento)](https://www.youtube.com/watch?v=W8GCjqYuMnU), [mudança de município (transferência)](https://www.youtube.com/watch?v=eYC23SnuF-Y), [alteração de dados pessoais](https://www.youtube.com/watch?v=UW-q1bsRFWI), alteração de local de votação por justificada necessidade de facilitação de mobilidade ou revisão para a regularização de inscrição cancelada.\n> \n\nMAS se for muito perto da eleição, os serviços do TSE são suspendidos e você só vai conseguir alterar após a eleição. 🙄\n\n> Os documentos digitalizados (ou foto deles) para fazer as alterações online são:\n> \n> - Documento oficial de identidade com foto (frente e verso).\n> - Comprovante de residência recente (no caso de transferência, prazo mínimo de três meses de residência no novo endereço).\n> - Comprovante de pagamento de débito com a Justiça Eleitoral (quando houver débito).\n> - Comprovante de quitação do serviço militar, para o alistamento, sendo o requerente do sexo masculino (para homens com 19 anos que ainda não tenham título eleitoral).\n> \n> **Faça também uma selfie** segurando, ao lado de sua face, o documento oficial de identificação, com o lado que contenha a foto voltado para a câmera.\n> \n\n### Junta Militar (reservista)\n\nSim, você vai ter que jurar a bandeira e é um saco pós pandemia. Pega todos os documentos alterados e os antigos e vá a junta militar mais próxima da sua casa - o que não é super recomendado, mas tenta perguntar pros homens cis da sua vida que não serviram no exército onde tem mais chance de você não ser convocado só de sacanagem. \n\nO reservista é um documento mega importante na hora de contratações CLT e também pra prestar concurso público ou fazer inscrição em faculdade. Se pá não te chamarão, mas mesmo assim você vai ter que pagar uma tarifa por se alistar \"atrasado\".\n\n## Passaporte\n\nPreencher formulário “Solicitar novo passaporte - Divisão de Passaporte - Polícia Federal” nesse site:\n\n[](http://dpf.gov.br/)\n\nSegundo informações da Casa 1:\n\n> Note que nesse formulário há dois campos importantes: “nome anterior” e “motivo da mudança”. No campo “Nome anterior” você deverá preencher o nome que estava no Passaporte antigo e em “Motivo”, você deve escolher a opção “ALTERAÇÃO POR DECISÃO JUDICIAL”, ainda que a retificação tenha sido realizada em cartório, uma vez que não há uma opção própria para isto.\n> \n\n> Com o número do Protocolo da Solicitação em mãos, você deverá acessar o seguinte link do Agendamento - Divisão de Passaporte - Polícia Federal (dpf.gov.br) e fazer o agendamento de um dia e horário, em algum posto de atendimento da Polícia Federal, para finalizar a solicitação de seu novo passaporte.\n> \n\n### Diploma ou Histórico Escolar\n\nImportantíssimo pra inscrição em faculdades ou em cursos, você consegue alterar indo em cada uma das instituições com os documentos novos e antigos em mãos. No caso de Ensino Básico (Fundamental e Médio), se a escola não estiver mais funcionando, dá pra pegar na Diretoria de Ensino que a escola está vinculada. \n\nPara instituições de Ensino Superior (Grad ou Pós Grad), levar os documentos novos e o diploma antigo pra solicitar a mudança do nome funciona sempre.\n\n### Micro Empreendedor Individual - MEI\n\nO MEI é vinculado com o CPF, então se o CPF tiver atualizado, possívelmente o cadastro do MEi também vai estar. Mas se não: se você for de SP, dá pra solicitar a alteração cadastral na prefeitura por esse site: \n\n[](http://prefeitura.sp.gov.br/)\n\n### Carteirinha SUS\n\nSó chegar na UBS mais próxima e mostrar o novo RG junto com a cópia do antigo, comprovante de residencia e seu Cartão da Família e pedir a alteração. Saí na hora já que agora as carteirinhas do SUS são um mero papelzinho, risos.\n\n### Outros documentos não públicos\n\nBom, acho que é isso é com cada um das empresas que você esteja vinculado como: convênio médico, bancos, contrato de aluguel, etc. **Por isso é importante você manter seus antigos documentos, sempre vai aparecer alguma coisa que você vai precisar alterar o nome e sexo nos momentos mais nada a ver da sua vida**.\n\n---\n\nAgora que expliquei tudinho, aqui vai uma listinha de tarefas para ajudar a lembrar de tudo que precisa ser alterado:\n\n## Lista de Tarefas\n\n- [ ]  RG\n- [ ]  CNH\n- [ ]  Alterar dados CPF\n- [ ]  Alterar dados INSS\n- [ ]  Titulo de Eleitor\n- [ ]  Pegar Reservista\n- [ ]  Passaporte\n- [ ]  Diplomas\n- [ ]  Histórico Escolar\n- [ ]  Alterar nome carteirinha SUS\n- [ ]  Alterar nome nos bancos\n- [ ]  Alterar nome no convênio médico\n- [ ]  Alterar nome operadora telefonica/internet\n- [ ]  Alterar nome IPTU/IPVA, etc","fields":{"title":"O que fazer após alteração de nome e sexo na certidão?","date":"2022-08-09T01:00:00.000Z","description":"um guiazinho pra entender o que fazer depois de conseguir sua certidão com seu nome novo s2 s2"},"frontmatter":{"tags":["transicao-de-genero","transgeneridade","genero"],"source":"[[Retificação]]"}}},"pageContext":{"title":"O que fazer após alteração de nome e sexo na certidão?","slug":"/apos-alteraco-de-nome-e-sexo","refersTo":["Retificação"],"referredBy":[],"linkedNotes":{}}},"staticQueryHashes":["1408915841","342892192"]}