{"componentChunkName":"component---src-templates-note-jsx","path":"/retificaco","result":{"data":{"mdx":{"body":"var _excluded = [\"components\"];\nfunction _extends() { _extends = Object.assign ? Object.assign.bind() : function (target) { for (var i = 1; i < arguments.length; i++) { var source = arguments[i]; for (var key in source) { if (Object.prototype.hasOwnProperty.call(source, key)) { target[key] = source[key]; } } } return target; }; return _extends.apply(this, arguments); }\nfunction _objectWithoutProperties(source, excluded) { if (source == null) return {}; var target = _objectWithoutPropertiesLoose(source, excluded); var key, i; if (Object.getOwnPropertySymbols) { var sourceSymbolKeys = Object.getOwnPropertySymbols(source); for (i = 0; i < sourceSymbolKeys.length; i++) { key = sourceSymbolKeys[i]; if (excluded.indexOf(key) >= 0) continue; if (!Object.prototype.propertyIsEnumerable.call(source, key)) continue; target[key] = source[key]; } } return target; }\nfunction _objectWithoutPropertiesLoose(source, excluded) { if (source == null) return {}; var target = {}; var sourceKeys = Object.keys(source); var key, i; for (i = 0; i < sourceKeys.length; i++) { key = sourceKeys[i]; if (excluded.indexOf(key) >= 0) continue; target[key] = source[key]; } return target; }\n/* @jsxRuntime classic */\n/* @jsx mdx */\n\nvar _frontmatter = {\n  \"title\": \"Retificação de nome e gênero para pessoas trans\",\n  \"description\": \"um guiazinho pra entender como retificar nome e gênero\",\n  \"tags\": [\"transicao-de-genero\", \"transgeneridade\", \"genero\"],\n  \"date\": \"2022-08-09T01:00:00.000Z\",\n  \"source\": \"[[Após alteração de nome e sexo]]\"\n};\nvar layoutProps = {\n  _frontmatter: _frontmatter\n};\nvar MDXLayout = \"wrapper\";\nreturn function MDXContent(_ref) {\n  var components = _ref.components,\n    props = _objectWithoutProperties(_ref, _excluded);\n  return mdx(MDXLayout, _extends({}, layoutProps, props, {\n    components: components,\n    mdxType: \"MDXLayout\"\n  }), mdx(\"h2\", null, \"Quais nossos direitos na retifica\\xE7\\xE3o?\"), mdx(\"p\", null, \"Confira o Provimento n\\xBA 73/2018 do Conselho Nacional de Justi\\xE7a que garante a Retifica\\xE7\\xE3o de Nome e G\\xEAnero no Registro C\\xEDvil - sendo ele Certid\\xE3o de Nascimento e/ou Certid\\xE3o de Casamento.\"), mdx(\"p\", null, mdx(\"a\", {\n    parentName: \"p\",\n    \"href\": \"https://atos.cnj.jus.br/atos/detalhar/2623\"\n  })), mdx(\"h2\", null, \"O que pensar antes da retifica\\xE7\\xE3o?\"), mdx(\"p\", null, \"Entenda que o Provimento do CNJ \\xE9 v\\xE1lido se voc\\xEA quer trocar ser prenome (ou seja, seu primeiro nome) e agnomes (aqueles nomes que ficam depois do sobrenome como Filho/a, Neto/a, Junior, etc). \", mdx(\"strong\", {\n    parentName: \"p\"\n  }, \"Se voc\\xEA quiser alterar a ordem de seus sobrenomes ou adicionar/remover sobrenomes, voc\\xEA ter\\xE1 que abrir um processo judicial para mudan\\xE7a de nome.\")), mdx(\"p\", null, \"Sabendo disso, voc\\xEA ter\\xE1 que escolher um nome pra voc\\xEA. E pode nome composto (como Jo\\xE3o Miguel \\uD83D\\uDC99) ou at\\xE9 mesmo nomes que n\\xE3o est\\xE3o em portugu\\xEAs. Desde que voc\\xEA n\\xE3o queira alterar o seu sobrenome, como disse anteriormente.\"), mdx(\"p\", null, \"A idade m\\xEDnima pra realizar a retifica\\xE7\\xE3o \\xE9 18 anos. Mesmo que pessoas menores de idade tiverem autoriza\\xE7\\xE3o de pais e respons\\xE1veis, o Provimento n\\xE3o \\xE9 aplic\\xE1vel para menores e as pessoas ter\\xE3o que abrir processo judicial. Nesse caso, o nome social ainda sim \\xE9 v\\xE1lido para menores. Para utilizar o nome social, segue informa\\xE7\\xF5es do Poupatrans:\"), mdx(\"blockquote\", null, mdx(\"p\", {\n    parentName: \"blockquote\"\n  }, \"Para utilizar o nome social em institui\\xE7\\xF5es escolares (lista de chamada e outros documentos internos), consulte a \", mdx(\"strong\", {\n    parentName: \"p\"\n  }, mdx(\"a\", {\n    parentName: \"strong\",\n    \"href\": \"http://portal.mec.gov.br/index.php?Itemid=30192.&alias=81001-rcp001-18-pdf&category_slug=janeiro-2018-pdf&option=com_docman&view=download\"\n  }, \"Resolu\\xE7\\xE3o n. 1 de 2018 do Conselho Nacional de Educa\\xE7\\xE3o (CNE)\")), \".  J\\xE1 quanto \\xE0 inclus\\xE3o do nome social no RG: ela pode ser feita atrav\\xE9s do Poupatempo, em acordo com \", mdx(\"strong\", {\n    parentName: \"p\"\n  }, mdx(\"a\", {\n    parentName: \"strong\",\n    \"href\": \"https://www.saopaulo.sp.gov.br/spnoticias/estado-de-sao-paulo-passara-a-emitir-novo-rg/\"\n  }, \"declara\\xE7\\xE3o do Governo do Estado de S\\xE3o Paulo (SP).\"))), mdx(\"p\", {\n    parentName: \"blockquote\"\n  }, \"Ainda assim, se voc\\xEA tiver menos de 18 anos, vai precisar de autoriza\\xE7\\xE3o de respons\\xE1vel legal para os dois procedimentos.\")), mdx(\"p\", null, \"Importante dizer que atualmente (agosto de 2022) n\\xE3o \\xE9 poss\\xEDvel adicionar o g\\xEAnero (a.ka sexo para as pessoas cis, risos!) como \", mdx(\"strong\", {\n    parentName: \"p\"\n  }, \"N\\xE3o Bin\\xE1rio\"), \". Algumas pessoas conseguiram esse direto abrindo processos judiciais que, obviamente, demoram mais tempo que a Retifica\\xE7\\xE3o em cart\\xF3rio. Ent\\xE3o voc\\xEA vai ter que escolher entre continuar com o mesmo g\\xEAnero ou trocar para o sexo Masculino ou Feminino. \\uD83D\\uDE44\"), mdx(\"p\", null, \"Se acontecer do cart\\xF3rio n\\xE3o quiser realizar o processo ou come\\xE7ar a questionar a escolha de seus nomes, entre em contato com a Defensoria P\\xFAblica porque a retifica\\xE7\\xE3o \\xE9 uma pr\\xE1tica de DEVE ser feita e a recusa ou qualquer tipo de viol\\xEAncia que voc\\xEA passar no processo deve ser informado a Defensoria. Se proteja!\"), mdx(\"h2\", null, \"Lista de documentos\"), mdx(\"p\", null, \"Essa \\xE9 uma grande lista de tarefas baseadas nas seguintes refer\\xEAncias:\"), mdx(\"ul\", null, mdx(\"li\", {\n    parentName: \"ul\"\n  }, mdx(\"p\", {\n    parentName: \"li\"\n  }, \"Poupatrans \", mdx(\"a\", {\n    parentName: \"p\",\n    \"href\": \"https://www.poupatrans.org.br/passoapasso\"\n  }, \"Passo a Passo - Poupatrans\"))), mdx(\"li\", {\n    parentName: \"ul\"\n  }, mdx(\"p\", {\n    parentName: \"li\"\n  }, \"Guia Casa 1/ANTRA/Baptista Luz Advogados de Retifica\\xE7\\xE3o do Registro Civil de pessoas n\\xE3o-cis: \", mdx(\"a\", {\n    parentName: \"p\",\n    \"href\": \"https://www.casaum.org/como-fazer-retificacao-de-nome-e-genero/\"\n  }, \"Como fazer retifica\\xE7\\xE3o de nome e g\\xEAnero - Casa 1\")))), mdx(\"p\", null, \"--\"), mdx(\"h4\", null, mdx(\"a\", {\n    parentName: \"h4\",\n    \"href\": \"https://www.notion.so/ef92a6b4d97c423ba3f3819e3ebd491e\"\n  }, \"O que levar no cart\\xF3rio pra retificar o nome e g\\xEAnero? no Notion\")), mdx(\"table\", null, mdx(\"thead\", {\n    parentName: \"table\"\n  }, mdx(\"tr\", {\n    parentName: \"thead\"\n  }, mdx(\"th\", {\n    parentName: \"tr\",\n    \"align\": null\n  }, \"Name\"), mdx(\"th\", {\n    parentName: \"tr\",\n    \"align\": null\n  }, \"Disponibilidade\"), mdx(\"th\", {\n    parentName: \"tr\",\n    \"align\": null\n  }, \"Local\"), mdx(\"th\", {\n    parentName: \"tr\",\n    \"align\": null\n  }, \"Territ\\xF3rio\"), mdx(\"th\", {\n    parentName: \"tr\",\n    \"align\": null\n  }, \"Tipo de Documento\"), mdx(\"th\", {\n    parentName: \"tr\",\n    \"align\": null\n  }, \"Valor\"))), mdx(\"tbody\", {\n    parentName: \"table\"\n  }, mdx(\"tr\", {\n    parentName: \"tbody\"\n  }, mdx(\"td\", {\n    parentName: \"tr\",\n    \"align\": null\n  }, \"CERTID\\xC3O DE QUITA\\xC7\\xC3O ELEITORAL\"), mdx(\"td\", {\n    parentName: \"tr\",\n    \"align\": null\n  }, \"Download imediato\"), mdx(\"td\", {\n    parentName: \"tr\",\n    \"align\": null\n  }, \"Internet\"), mdx(\"td\", {\n    parentName: \"tr\",\n    \"align\": null\n  }, \"Todo o Brasil\"), mdx(\"td\", {\n    parentName: \"tr\",\n    \"align\": null\n  }, \"Documento p\\xFAblico\"), mdx(\"td\", {\n    parentName: \"tr\",\n    \"align\": null\n  }, \"Gratuito\")), mdx(\"tr\", {\n    parentName: \"tbody\"\n  }, mdx(\"td\", {\n    parentName: \"tr\",\n    \"align\": null\n  }, \"CERTID\\xC3O DE CRIMES ELEITORAIS\"), mdx(\"td\", {\n    parentName: \"tr\",\n    \"align\": null\n  }, \"Download imediato\"), mdx(\"td\", {\n    parentName: \"tr\",\n    \"align\": null\n  }, \"Internet\"), mdx(\"td\", {\n    parentName: \"tr\",\n    \"align\": null\n  }, \"Todo o Brasil\"), mdx(\"td\", {\n    parentName: \"tr\",\n    \"align\": null\n  }, \"Documento p\\xFAblico\"), mdx(\"td\", {\n    parentName: \"tr\",\n    \"align\": null\n  }, \"Gratuito\")), mdx(\"tr\", {\n    parentName: \"tbody\"\n  }, mdx(\"td\", {\n    parentName: \"tr\",\n    \"align\": null\n  }, \"CERTID\\xC3O DE DISTRIBUI\\xC7\\xC3O C\\xCDVEL\"), mdx(\"td\", {\n    parentName: \"tr\",\n    \"align\": null\n  }, \"Chega no e-mail em alguns dias\"), mdx(\"td\", {\n    parentName: \"tr\",\n    \"align\": null\n  }, \"Internet\"), mdx(\"td\", {\n    parentName: \"tr\",\n    \"align\": null\n  }, \"Somente S\\xE3o Paulo\"), mdx(\"td\", {\n    parentName: \"tr\",\n    \"align\": null\n  }, \"Documento p\\xFAblico\"), mdx(\"td\", {\n    parentName: \"tr\",\n    \"align\": null\n  }, \"Gratuito\")), mdx(\"tr\", {\n    parentName: \"tbody\"\n  }, mdx(\"td\", {\n    parentName: \"tr\",\n    \"align\": null\n  }, \"CERTID\\xC3O CRIMINAL ESTADUAL\"), mdx(\"td\", {\n    parentName: \"tr\",\n    \"align\": null\n  }, \"Chega no e-mail em alguns dias\"), mdx(\"td\", {\n    parentName: \"tr\",\n    \"align\": null\n  }, \"Internet\"), mdx(\"td\", {\n    parentName: \"tr\",\n    \"align\": null\n  }, \"Somente S\\xE3o Paulo\"), mdx(\"td\", {\n    parentName: \"tr\",\n    \"align\": null\n  }, \"Documento p\\xFAblico\"), mdx(\"td\", {\n    parentName: \"tr\",\n    \"align\": null\n  }, \"Gratuito\")), mdx(\"tr\", {\n    parentName: \"tbody\"\n  }, mdx(\"td\", {\n    parentName: \"tr\",\n    \"align\": null\n  }, \"CERTID\\xC3O DE EXECU\\xC7\\xC3O CRIMINAL - SAJ\"), mdx(\"td\", {\n    parentName: \"tr\",\n    \"align\": null\n  }, \"Chega no e-mail em alguns dias\"), mdx(\"td\", {\n    parentName: \"tr\",\n    \"align\": null\n  }, \"Internet\"), mdx(\"td\", {\n    parentName: \"tr\",\n    \"align\": null\n  }, \"Somente S\\xE3o Paulo\"), mdx(\"td\", {\n    parentName: \"tr\",\n    \"align\": null\n  }, \"Documento p\\xFAblico\"), mdx(\"td\", {\n    parentName: \"tr\",\n    \"align\": null\n  }, \"Gratuito\")), mdx(\"tr\", {\n    parentName: \"tbody\"\n  }, mdx(\"td\", {\n    parentName: \"tr\",\n    \"align\": null\n  }, \"CERTID\\xC3O DE EXECU\\xC7\\xC3O CRIMINAL SIVEC\"), mdx(\"td\", {\n    parentName: \"tr\",\n    \"align\": null\n  }, \"Chega no e-mail em alguns dias\"), mdx(\"td\", {\n    parentName: \"tr\",\n    \"align\": null\n  }, \"Internet\"), mdx(\"td\", {\n    parentName: \"tr\",\n    \"align\": null\n  }, \"Somente S\\xE3o Paulo\"), mdx(\"td\", {\n    parentName: \"tr\",\n    \"align\": null\n  }, \"Documento p\\xFAblico\"), mdx(\"td\", {\n    parentName: \"tr\",\n    \"align\": null\n  }, \"Gratuito\")), mdx(\"tr\", {\n    parentName: \"tbody\"\n  }, mdx(\"td\", {\n    parentName: \"tr\",\n    \"align\": null\n  }, \"1\\xAA CERTID\\xC3O DA JUSTI\\xC7A FEDERAL\"), mdx(\"td\", {\n    parentName: \"tr\",\n    \"align\": null\n  }, \"Download imediato\"), mdx(\"td\", {\n    parentName: \"tr\",\n    \"align\": null\n  }, \"Internet\"), mdx(\"td\", {\n    parentName: \"tr\",\n    \"align\": null\n  }, \"Todo o Brasil\"), mdx(\"td\", {\n    parentName: \"tr\",\n    \"align\": null\n  }, \"Documento p\\xFAblico\"), mdx(\"td\", {\n    parentName: \"tr\",\n    \"align\": null\n  }, \"Gratuito\")), mdx(\"tr\", {\n    parentName: \"tbody\"\n  }, mdx(\"td\", {\n    parentName: \"tr\",\n    \"align\": null\n  }, \"2\\xAA CERTID\\xC3O DA JUSTI\\xC7A FEDERAL\"), mdx(\"td\", {\n    parentName: \"tr\",\n    \"align\": null\n  }, \"Download imediato\"), mdx(\"td\", {\n    parentName: \"tr\",\n    \"align\": null\n  }, \"Internet\"), mdx(\"td\", {\n    parentName: \"tr\",\n    \"align\": null\n  }, \"Todo o Brasil\"), mdx(\"td\", {\n    parentName: \"tr\",\n    \"align\": null\n  }, \"Documento p\\xFAblico\"), mdx(\"td\", {\n    parentName: \"tr\",\n    \"align\": null\n  }, \"Gratuito\")), mdx(\"tr\", {\n    parentName: \"tbody\"\n  }, mdx(\"td\", {\n    parentName: \"tr\",\n    \"align\": null\n  }, \"CERTID\\xC3O DE RECLAMA\\xC7\\xC3O TRABALHISTA\"), mdx(\"td\", {\n    parentName: \"tr\",\n    \"align\": null\n  }, \"Download imediato\"), mdx(\"td\", {\n    parentName: \"tr\",\n    \"align\": null\n  }, \"Internet\"), mdx(\"td\", {\n    parentName: \"tr\",\n    \"align\": null\n  }, \"Todo o Brasil\"), mdx(\"td\", {\n    parentName: \"tr\",\n    \"align\": null\n  }, \"Documento p\\xFAblico\"), mdx(\"td\", {\n    parentName: \"tr\",\n    \"align\": null\n  }, \"Gratuito\")), mdx(\"tr\", {\n    parentName: \"tbody\"\n  }, mdx(\"td\", {\n    parentName: \"tr\",\n    \"align\": null\n  }, \"CERTID\\xC3O DO SUPERIOR TRIBUNAL MILITAR\"), mdx(\"td\", {\n    parentName: \"tr\",\n    \"align\": null\n  }, \"Download imediato\"), mdx(\"td\", {\n    parentName: \"tr\",\n    \"align\": null\n  }, \"Internet\"), mdx(\"td\", {\n    parentName: \"tr\",\n    \"align\": null\n  }, \"Todo o Brasil\"), mdx(\"td\", {\n    parentName: \"tr\",\n    \"align\": null\n  }, \"Documento p\\xFAblico\"), mdx(\"td\", {\n    parentName: \"tr\",\n    \"align\": null\n  }, \"Gratuito\")), mdx(\"tr\", {\n    parentName: \"tbody\"\n  }, mdx(\"td\", {\n    parentName: \"tr\",\n    \"align\": null\n  }, \"CERTID\\xC3O NEGATIVA DE ANTECEDENTES CRIMINAIS\"), mdx(\"td\", {\n    parentName: \"tr\",\n    \"align\": null\n  }, \"Download imediato\"), mdx(\"td\", {\n    parentName: \"tr\",\n    \"align\": null\n  }, \"Internet\"), mdx(\"td\", {\n    parentName: \"tr\",\n    \"align\": null\n  }, \"Todo o Brasil\"), mdx(\"td\", {\n    parentName: \"tr\",\n    \"align\": null\n  }, \"Documento p\\xFAblico\"), mdx(\"td\", {\n    parentName: \"tr\",\n    \"align\": null\n  }, \"Gratuito\")), mdx(\"tr\", {\n    parentName: \"tbody\"\n  }, mdx(\"td\", {\n    parentName: \"tr\",\n    \"align\": null\n  }, \"CERTID\\xD5ES DE PROTESTO\"), mdx(\"td\", {\n    parentName: \"tr\",\n    \"align\": null\n  }, \"Chega no e-mail em alguns dias\"), mdx(\"td\", {\n    parentName: \"tr\",\n    \"align\": null\n  }, \"Internet, Pessoalmente\"), mdx(\"td\", {\n    parentName: \"tr\",\n    \"align\": null\n  }, \"Todo o Brasil\"), mdx(\"td\", {\n    parentName: \"tr\",\n    \"align\": null\n  }, \"Documento p\\xFAblico\"), mdx(\"td\", {\n    parentName: \"tr\",\n    \"align\": null\n  }, \"Pago\")), mdx(\"tr\", {\n    parentName: \"tbody\"\n  }, mdx(\"td\", {\n    parentName: \"tr\",\n    \"align\": null\n  }, \"C\\xD3PIA E ORIGINAL DA CERTID\\xC3O DE NASCIMENTO COM NOME MORTO\"), mdx(\"td\", {\n    parentName: \"tr\",\n    \"align\": null\n  }), mdx(\"td\", {\n    parentName: \"tr\",\n    \"align\": null\n  }), mdx(\"td\", {\n    parentName: \"tr\",\n    \"align\": null\n  }, \"Todo o Brasil\"), mdx(\"td\", {\n    parentName: \"tr\",\n    \"align\": null\n  }, \"Documento pessoal\"), mdx(\"td\", {\n    parentName: \"tr\",\n    \"align\": null\n  })), mdx(\"tr\", {\n    parentName: \"tbody\"\n  }, mdx(\"td\", {\n    parentName: \"tr\",\n    \"align\": null\n  }, \"C\\xD3PIA E ORIGINAL DA CERTID\\xC3O DE CASAMENTO COM NOME MORTO\"), mdx(\"td\", {\n    parentName: \"tr\",\n    \"align\": null\n  }), mdx(\"td\", {\n    parentName: \"tr\",\n    \"align\": null\n  }), mdx(\"td\", {\n    parentName: \"tr\",\n    \"align\": null\n  }, \"Todo o Brasil\"), mdx(\"td\", {\n    parentName: \"tr\",\n    \"align\": null\n  }, \"Documento pessoal\"), mdx(\"td\", {\n    parentName: \"tr\",\n    \"align\": null\n  })), mdx(\"tr\", {\n    parentName: \"tbody\"\n  }, mdx(\"td\", {\n    parentName: \"tr\",\n    \"align\": null\n  }, \"C\\xD3PIA E ORIGINAL DO RG\"), mdx(\"td\", {\n    parentName: \"tr\",\n    \"align\": null\n  }), mdx(\"td\", {\n    parentName: \"tr\",\n    \"align\": null\n  }), mdx(\"td\", {\n    parentName: \"tr\",\n    \"align\": null\n  }, \"Todo o Brasil\"), mdx(\"td\", {\n    parentName: \"tr\",\n    \"align\": null\n  }, \"Documento pessoal\"), mdx(\"td\", {\n    parentName: \"tr\",\n    \"align\": null\n  })), mdx(\"tr\", {\n    parentName: \"tbody\"\n  }, mdx(\"td\", {\n    parentName: \"tr\",\n    \"align\": null\n  }, \"C\\xD3PIA E ORIGINAL DO PASSAPORTE\"), mdx(\"td\", {\n    parentName: \"tr\",\n    \"align\": null\n  }), mdx(\"td\", {\n    parentName: \"tr\",\n    \"align\": null\n  }), mdx(\"td\", {\n    parentName: \"tr\",\n    \"align\": null\n  }, \"Todo o Brasil\"), mdx(\"td\", {\n    parentName: \"tr\",\n    \"align\": null\n  }, \"Documento pessoal\"), mdx(\"td\", {\n    parentName: \"tr\",\n    \"align\": null\n  })), mdx(\"tr\", {\n    parentName: \"tbody\"\n  }, mdx(\"td\", {\n    parentName: \"tr\",\n    \"align\": null\n  }, \"C\\xD3PIA E ORIGINAL DO CPF\"), mdx(\"td\", {\n    parentName: \"tr\",\n    \"align\": null\n  }), mdx(\"td\", {\n    parentName: \"tr\",\n    \"align\": null\n  }), mdx(\"td\", {\n    parentName: \"tr\",\n    \"align\": null\n  }, \"Todo o Brasil\"), mdx(\"td\", {\n    parentName: \"tr\",\n    \"align\": null\n  }, \"Documento pessoal\"), mdx(\"td\", {\n    parentName: \"tr\",\n    \"align\": null\n  })), mdx(\"tr\", {\n    parentName: \"tbody\"\n  }, mdx(\"td\", {\n    parentName: \"tr\",\n    \"align\": null\n  }, \"C\\xD3PIA E ORIGINAL DO TITULO DE ELEITOR\"), mdx(\"td\", {\n    parentName: \"tr\",\n    \"align\": null\n  }), mdx(\"td\", {\n    parentName: \"tr\",\n    \"align\": null\n  }), mdx(\"td\", {\n    parentName: \"tr\",\n    \"align\": null\n  }, \"Todo o Brasil\"), mdx(\"td\", {\n    parentName: \"tr\",\n    \"align\": null\n  }, \"Documento pessoal\"), mdx(\"td\", {\n    parentName: \"tr\",\n    \"align\": null\n  })), mdx(\"tr\", {\n    parentName: \"tbody\"\n  }, mdx(\"td\", {\n    parentName: \"tr\",\n    \"align\": null\n  }, \"C\\xD3PIA E ORIGINAL DO COMPROVANTE DE RESID\\xCANCIA\"), mdx(\"td\", {\n    parentName: \"tr\",\n    \"align\": null\n  }), mdx(\"td\", {\n    parentName: \"tr\",\n    \"align\": null\n  }), mdx(\"td\", {\n    parentName: \"tr\",\n    \"align\": null\n  }, \"Todo o Brasil\"), mdx(\"td\", {\n    parentName: \"tr\",\n    \"align\": null\n  }, \"Documento pessoal\"), mdx(\"td\", {\n    parentName: \"tr\",\n    \"align\": null\n  })))));\n}\n;\nMDXContent.isMDXComponent = true;","rawBody":"---\ntitle: Retificação de nome e gênero para pessoas trans\ndescription: um guiazinho pra entender como retificar nome e gênero\ntags:\n  - transicao-de-genero\n  - transgeneridade\n  - genero\n\ndate: 2022-08-09 1:00:00\nsource: '[[Após alteração de nome e sexo]]'\n---\n\n## Quais nossos direitos na retificação?\n\nConfira o Provimento nº 73/2018 do Conselho Nacional de Justiça que garante a Retificação de Nome e Gênero no Registro Cívil - sendo ele Certidão de Nascimento e/ou Certidão de Casamento.\n\n[](https://atos.cnj.jus.br/atos/detalhar/2623)\n\n## O que pensar antes da retificação?\n\nEntenda que o Provimento do CNJ é válido se você quer trocar ser prenome (ou seja, seu primeiro nome) e agnomes (aqueles nomes que ficam depois do sobrenome como Filho/a, Neto/a, Junior, etc). **Se você quiser alterar a ordem de seus sobrenomes ou adicionar/remover sobrenomes, você terá que abrir um processo judicial para mudança de nome.**\n\nSabendo disso, você terá que escolher um nome pra você. E pode nome composto (como João Miguel 💙) ou até mesmo nomes que não estão em português. Desde que você não queira alterar o seu sobrenome, como disse anteriormente.\n\nA idade mínima pra realizar a retificação é 18 anos. Mesmo que pessoas menores de idade tiverem autorização de pais e responsáveis, o Provimento não é aplicável para menores e as pessoas terão que abrir processo judicial. Nesse caso, o nome social ainda sim é válido para menores. Para utilizar o nome social, segue informações do Poupatrans:\n\n> Para utilizar o nome social em instituições escolares (lista de chamada e outros documentos internos), consulte a **[Resolução n. 1 de 2018 do Conselho Nacional de Educação (CNE)](http://portal.mec.gov.br/index.php?Itemid=30192.&alias=81001-rcp001-18-pdf&category_slug=janeiro-2018-pdf&option=com_docman&view=download)**.  Já quanto à inclusão do nome social no RG: ela pode ser feita através do Poupatempo, em acordo com **[declaração do Governo do Estado de São Paulo (SP).](https://www.saopaulo.sp.gov.br/spnoticias/estado-de-sao-paulo-passara-a-emitir-novo-rg/)**\n> \n> \n> Ainda assim, se você tiver menos de 18 anos, vai precisar de autorização de responsável legal para os dois procedimentos.\n> \n\nImportante dizer que atualmente (agosto de 2022) não é possível adicionar o gênero (a.ka sexo para as pessoas cis, risos!) como **Não Binário**. Algumas pessoas conseguiram esse direto abrindo processos judiciais que, obviamente, demoram mais tempo que a Retificação em cartório. Então você vai ter que escolher entre continuar com o mesmo gênero ou trocar para o sexo Masculino ou Feminino. 🙄\n\nSe acontecer do cartório não quiser realizar o processo ou começar a questionar a escolha de seus nomes, entre em contato com a Defensoria Pública porque a retificação é uma prática de DEVE ser feita e a recusa ou qualquer tipo de violência que você passar no processo deve ser informado a Defensoria. Se proteja!\n\n## Lista de documentos\n\nEssa é uma grande lista de tarefas baseadas nas seguintes referências:\n\n- Poupatrans [Passo a Passo - Poupatrans](https://www.poupatrans.org.br/passoapasso)\n\n- Guia Casa 1/ANTRA/Baptista Luz Advogados de Retificação do Registro Civil de pessoas não-cis: [Como fazer retificação de nome e gênero - Casa 1](https://www.casaum.org/como-fazer-retificacao-de-nome-e-genero/)\n\n--\n\n#### [O que levar no cartório pra retificar o nome e gênero? no Notion](https://www.notion.so/ef92a6b4d97c423ba3f3819e3ebd491e)\n\n|Name                                                     |Disponibilidade               |Local                 |Território       |Tipo de Documento|Valor   |\n|---------------------------------------------------------|------------------------------|----------------------|-----------------|-----------------|--------|\n|CERTIDÃO DE QUITAÇÃO ELEITORAL                           |Download imediato             |Internet              |Todo o Brasil    |Documento público|Gratuito|\n|CERTIDÃO DE CRIMES ELEITORAIS                            |Download imediato             |Internet              |Todo o Brasil    |Documento público|Gratuito|\n|CERTIDÃO DE DISTRIBUIÇÃO CÍVEL                           |Chega no e-mail em alguns dias|Internet              |Somente São Paulo|Documento público|Gratuito|\n|CERTIDÃO CRIMINAL ESTADUAL                               |Chega no e-mail em alguns dias|Internet              |Somente São Paulo|Documento público|Gratuito|\n|CERTIDÃO DE EXECUÇÃO CRIMINAL - SAJ                      |Chega no e-mail em alguns dias|Internet              |Somente São Paulo|Documento público|Gratuito|\n|CERTIDÃO DE EXECUÇÃO CRIMINAL SIVEC                      |Chega no e-mail em alguns dias|Internet              |Somente São Paulo|Documento público|Gratuito|\n|1ª CERTIDÃO DA JUSTIÇA FEDERAL                           |Download imediato             |Internet              |Todo o Brasil    |Documento público|Gratuito|\n|2ª CERTIDÃO DA JUSTIÇA FEDERAL                           |Download imediato             |Internet              |Todo o Brasil    |Documento público|Gratuito|\n|CERTIDÃO DE RECLAMAÇÃO TRABALHISTA                       |Download imediato             |Internet              |Todo o Brasil    |Documento público|Gratuito|\n|CERTIDÃO DO SUPERIOR TRIBUNAL MILITAR                    |Download imediato             |Internet              |Todo o Brasil    |Documento público|Gratuito|\n|CERTIDÃO NEGATIVA DE ANTECEDENTES CRIMINAIS              |Download imediato             |Internet              |Todo o Brasil    |Documento público|Gratuito|\n|CERTIDÕES DE PROTESTO                                    |Chega no e-mail em alguns dias|Internet, Pessoalmente|Todo o Brasil    |Documento público|Pago    |\n|CÓPIA E ORIGINAL DA CERTIDÃO DE NASCIMENTO COM NOME MORTO|                              |                      |Todo o Brasil    |Documento pessoal|        |\n|CÓPIA E ORIGINAL DA CERTIDÃO DE CASAMENTO COM NOME MORTO |                              |                      |Todo o Brasil    |Documento pessoal|        |\n|CÓPIA E ORIGINAL DO RG                                   |                              |                      |Todo o Brasil    |Documento pessoal|        |\n|CÓPIA E ORIGINAL DO PASSAPORTE                           |                              |                      |Todo o Brasil    |Documento pessoal|        |\n|CÓPIA E ORIGINAL DO CPF                                  |                              |                      |Todo o Brasil    |Documento pessoal|        |\n|CÓPIA E ORIGINAL DO TITULO DE ELEITOR                    |                              |                      |Todo o Brasil    |Documento pessoal|        |\n|CÓPIA E ORIGINAL DO COMPROVANTE DE RESIDÊNCIA            |                              |                      |Todo o Brasil    |Documento pessoal|        |\n","fields":{"title":"Retificação de nome e gênero para pessoas trans","date":"2022-08-09T01:00:00.000Z","description":"um guiazinho pra entender como retificar nome e gênero"},"frontmatter":{"tags":["transicao-de-genero","transgeneridade","genero"],"source":"[[Após alteração de nome e sexo]]"}}},"pageContext":{"title":"Retificação de nome e gênero para pessoas trans","slug":"/retificaco","refersTo":["Após alteração de nome e sexo"],"referredBy":[],"linkedNotes":{}}},"staticQueryHashes":["1408915841","342892192"]}